"80","Ball Canning Jar","5.35BallMasonJarWithZincThreadedLid.png","Ball mason jar with zinc threaded lid. Blue glass. Writing on jar is, 'Ball Mason.'","3D","","<script async src='https://api.cappasity.com/api/player/cappasity-ai'></script><iframe width='100%' height='600px' frameborder='0' allowfullscreen mozallowfullscreen='true' webkitallowfullscreen='true' style='border:0;' src='https://api.cappasity.com/api/player/0ba302cb-9469-45da-984a-895ee0d1e0ee/embedded?autorun=0&closebutton=1&logo=1&analytics=1&uipadx=0&uipady=0&enablestoreurl=0&storeurl=&hidehints=0&autorotate=0&autorotatetime=10&autorotatedelay=2&autorotatedir=1&hidefullscreen=1&hideautorotateopt=1&hidesettingsbtn=0&enableimagezoom=1&zoomquality=1&hidezoomopt=0&arbutton=1' ></iframe>","","Original","C. 1910-1923","Ball Corporation","Attic Artifacts: WWII Kids; Victory Gardens; Use it Up","The General","IKEducation","World War II; home front; World War II Kids; women; rationing; conserving; Attic Artifacts; Victory Gardens; canning","","5.35"
"81","Rationing Means a Fair Share for All of Us","5.36.RationingMeansaFairShareforAllofUs.1315.jpg","Poster: 'Rationing Means a Fair Share for All of Us.' Many posters were produced during World War II to instill in the people a sense of patriotism and to encourage all Americans to help with the war effort. The posters called upon every American to endure the personal sacrifice and domestic adjustments on the home front needed to win the war.","image","5.36.RationingMeansaFairShareforAllofUs.1315.jpg","","","Replica","1943-1945","Office for Emergency Management, Office of War Information. Domestic Operations Branch. Bureau of Special Services. ","Attic Artifacts: WWII Kids; Use it Up","The General","IKEducation","World War II; home front; World War II Kids; women; rationing; conserving; Attic Artifacts; poster; propaganda","","5.36"
"82","America Needs Your Scrap Rubber","5.37.AmericaNeedsYourScrapRubber.1314.jpg","Poster: 'America Needs Your Scrap Rubber' 72 x 51 cm.  During World War II, most of the world's supply of natural rubber came from rubber tree plantations in Southeast Asia, which were quickly occupied by the Japanese in the first months of 1942. Factories converting to military production needed every scrap of rubber they could find, and citizens were asked to turn in old tires, raincoats, gloves, garden hoses, and rubber shoes for recycling. New tires became almost impossible to buy, and people tell stories of lining the insides of their tires with newspaper to make them last longer.","image","5.37.AmericaNeedsYourScrapRubber.1314.jpg","","","Replica","1942","U.S. Production Board, U.S. G.P.O.","Attic Artifacts: WWII Kids; Use it Up","The General","IKEducation","World War II; home front; World War II Kids; women; rationing; conserving; Attic Artifacts; poster; propaganda","","5.37"
"83","I'm Out to Like Runaway Prices","8.02.ImouttoLickRunawayPrices.1325.jpg","Poster: 'I'm Out to Like Runaway Prices.'  This World War II poster promotes behaviors that will help the U.S. economy be resilitant during the hardship of war. The 7 keys spell Victory, and are Buy war bonds, pay taxes, provide life insurance, reduce debts, buy only what is needed, follow ration rules, cooperate with government programs. Measures 71.5 x 51 cm. ","image","8.02.ImouttoLickRunawayPrices.1325.jpg","","","Replica","c. 1944","Office of Economic Stabilization","Attic Artifacts: WWII Kids; Use it Up","The General","IKEducation","World War II; home front; World War II Kids; women; rationing; conserving; Attic Artifacts; poster; propaganda","","8.02"
"84","We'll Have Lots to Eat this Winter, Won't We Mother?","8.15.WellhavelotstoeatthiswinterwontweMother.1321.jpg","Poster: 'We'll Have Lots to Eat this Winter, Won't We Mother?' Many posters were produced during World War II to instill in the people a sense of patriotism and to encourage all Americans to help with the war effort. The posters called upon every American to endure the personal sacrifice and domestic adjustments on the home front needed to win the war.","image","8.15.WellhavelotstoeatthiswinterwontweMother.1321.jpg","","","Replica","1943","art by Alfed Parker, Office of War Information","Attic Artifacts: WWII Kids; Use it Up","The General","IKEducation","World War II; home front; World War II Kids; women; rationing; conserving; Attic Artifacts; poster; propaganda","","8.15"
"85","Kodak Created, U.S. Government Adopts V-Mail","13.12.Kodakcreated,U.S.GovernmentadoptsV-Mail.1333.jpg","Magazine advertisement: 'Kodak created, U.S. Government adopts V-Mail' ","image","13.12.Kodakcreated,U.S.GovernmentadoptsV-Mail.1333.jpg","","","Original","1942","Kodak Eastman","V-Mail","The General","IKEducation","World War II; home front; V-Mail; communication; advertisement; letters","","13.12"
"86","It's Mail they Want . . . Let's Give Them Plenty!","13.13.ParkerQuinkItsmailtheywant.1331.jpg","Magazine advertisement: 'It's Mail they Want . . . Let's Give Them Plenty!' This ad is an example of how many businesses adapted to new wartime needs.  V-Mail was a new invention and the government encouraged its use. The Parker fountain pen company adapted by branding their ink as 'Quink: for V-Mail' in 'microfilm black.'","image","13.13.ParkerQuinkItsmailtheywant.1331.jpg","","","Original","1943","Parker Co","V-Mail","The General","IKEducation","World War II; home front; V-Mail; communication; advertisement; letters","","13.13"
"87","SCRAP","5.38SCRAP.png","Poster: 'SCRAP' Man's fist holds scrap metal. The U.S. government produced posters like this during WWII to encourage people, like farmers, to donate their scrap metal to be recycled for war materials.","image","5.38SCRAP.png","","","Replica","1943 - 1945","Office for Emergency Management. Office of War Information. Domestic Operations Branch. Bureau of Special Services","Attic Artifacts: WWII Kids; Use it Up","The General","IKEducation","World War II; home front; World War II Kids; women; rationing; conserving; Attic Artifacts; poster; propaganda","","5.38"
"88","Are You Doing All You Can?","5.39Are_You_doing_all_you_can.jpg","Poster: 'Are You Doing All ou Can?'  Many posters were produced during World War II to instill in the people a sense of patriotism and to encourage all Americans to help with the war effort. The posters called upon every American to endure the personal sacrifice and domestic adjustments on the home front needed to win the war.","image","5.39Are_You_doing_all_you_can.jpg","","","Replica","1942","General Cable Corp","Attic Artifacts: WWII Kids; Use it Up; Victory Gardens","The General","IKEducation","World War II; home front; World War II Kids; women; rationing; conserving; Attic Artifacts; poster; propaganda","","5.39"
"89","Ball Blue Book","5.44BallBlueBook.png","The Ball Blue Book of canning and preserving recipes is a complete guide to home canning and preserving.
Edition: T-3","3D","","<script async src='https://api.cappasity.com/api/player/cappasity-ai'></script><iframe width='100%' height='600px' frameborder='0' allowfullscreen mozallowfullscreen='true' webkitallowfullscreen='true' style='border:0;' src='https://api.cappasity.com/api/player/a5b7fcb5-f195-49c0-996f-88159f842306/embedded?autorun=0&closebutton=1&logo=1&analytics=1&uipadx=0&uipady=0&enablestoreurl=0&storeurl=&hidehints=0&autorotate=0&autorotatetime=10&autorotatedelay=2&autorotatedir=1&hidefullscreen=1&hideautorotateopt=1&hidesettingsbtn=0&enableimagezoom=1&zoomquality=1&hidezoomopt=0&arbutton=1' ></iframe>","","Original","1938","Published by Ball Brothers Co. in Muncie, Indiana","Use it Up; Victory Gardens","The General","IKEducation","World War II; home front; women; rationing; conserving; Attic Artifacts; Victory Gardens","","5.44"
"90","Iron Pills for Hitler","5.48RxIronPillsforHitler.png","Photo of children on a heap of scrap metal and a sign that reads, 'Iron Pills for Hitler.'","3D","","<script async src='https://api.cappasity.com/api/player/cappasity-ai'></script><iframe width='100%' height='600px' frameborder='0' allowfullscreen mozallowfullscreen='true' webkitallowfullscreen='true' style='border:0;' src='https://api.cappasity.com/api/player/c330850a-2942-4f6e-9932-4850efceb882/embedded?autorun=0&closebutton=1&logo=1&analytics=1&uipadx=0&uipady=0&enablestoreurl=0&storeurl=&hidehints=0&autorotate=0&autorotatetime=10&autorotatedelay=2&autorotatedir=1&hidefullscreen=1&hideautorotateopt=1&hidesettingsbtn=0&enableimagezoom=1&zoomquality=1&hidezoomopt=0&arbutton=1' ></iframe>","","Replica","c. 1942","Jones, Leslie, 1886-1967","Attic Artifacts: WWII Kids; Use it Up","The General","IKEducation","World War II; home front; World War II Kids; women; rationing; conserving; Attic Artifacts","Retrieved from the Digital Commonwealth of Massachusettes; Educational Use Only","5.48"
"91","Holgate Toy Notice","5.50HolgateBrsToyNotice.png","This is a notice from Holgate Brothers Company providing information from the company to retail stores about discontinuing certain toys in an effort to comply with wartime limitations.","3D","","<script async src='https://api.cappasity.com/api/player/cappasity-ai'></script><iframe width='100%' height='600px' frameborder='0' allowfullscreen mozallowfullscreen='true' webkitallowfullscreen='true' style='border:0;' src='https://api.cappasity.com/api/player/c052e23d-1165-4649-b574-bd87f566b731/embedded?autorun=0&closebutton=1&logo=1&analytics=1&uipadx=0&uipady=0&enablestoreurl=0&storeurl=&hidehints=0&autorotate=0&autorotatetime=10&autorotatedelay=2&autorotatedir=1&hidefullscreen=1&hideautorotateopt=1&hidesettingsbtn=0&enableimagezoom=1&zoomquality=1&hidezoomopt=0&arbutton=1' ></iframe>","","Replica","1942","Holgate Brothers Company","Attic Artifacts: WWII Kids; Use it Up","The General","IKEducation","World War II; home front; World War II Kids; women; rationing; conserving; Attic Artifacts","","5.5"
"92","Victory Garden Scrapbook","5.51VictoryGardenScrapbook.png","This is a scrapbook filled with newspaper articles and pictures about Victory Gardens made by 'Kurt, Age 3' and given to 'Dearest Grandma,' according to the inscription.","3D","","<script async src='https://api.cappasity.com/api/player/cappasity-ai'></script><iframe width='100%' height='600px' frameborder='0' allowfullscreen mozallowfullscreen='true' webkitallowfullscreen='true' style='border:0;' src='https://api.cappasity.com/api/player/ad087a63-38e2-46c8-ace3-075a1586fd44/embedded?autorun=0&closebutton=1&logo=1&analytics=1&uipadx=0&uipady=0&enablestoreurl=0&storeurl=&hidehints=0&autorotate=0&autorotatetime=10&autorotatedelay=2&autorotatedir=1&hidefullscreen=1&hideautorotateopt=1&hidesettingsbtn=0&enableimagezoom=1&zoomquality=1&hidezoomopt=0&arbutton=1' ></iframe>","","Original","June 26, 1942","Kurt, Age 3","Use it Up; Victory Gardens; Attic Artifacts: WWII Kids","The General","IKEducation","World War II; home front; women; rationing; conserving; Attic Artifacts; Victory Gardens","","5.51"
"93","Bilboa Catcher","6.01BilboaCatcher.png","This wooden bilbo catcher, also called cup-and-ball, is a traditional child’s toy that was especially popular for children at the turn of the 20th century. It is a wooden cup with a handle, and a small ball attached to the cup by a string. The child holds onto the stick handle and swings the ball with goal of catching the ball in the cup.","3D","","<script async src='https://api.cappasity.com/api/player/cappasity-ai'></script><iframe width='100%' height='600px' frameborder='0' allowfullscreen mozallowfullscreen='true' webkitallowfullscreen='true' style='border:0;' src='https://api.cappasity.com/api/player/e758faa7-fcab-4d4c-aa88-eed690a4c49e/embedded?autorun=0&closebutton=1&logo=1&analytics=1&uipadx=0&uipady=0&enablestoreurl=0&storeurl=&hidehints=0&autorotate=0&autorotatetime=10&autorotatedelay=2&autorotatedir=1&hidefullscreen=1&hideautorotateopt=1&hidesettingsbtn=0&enableimagezoom=1&zoomquality=1&hidezoomopt=0&arbutton=1' ></iframe>","","Original","c. 2015","unknown","Little Ike Artifacts","Boyhood","IKEducation","Attic Artifacts, Little Ike, childhood, toy, kids, Abilene","","6.01"
"94","Rosie' dropping off kids at daycare","8.03Rosiedroppingoffkids.png","This is a photograph of a working mother dropping her kids off at the Maritime Childcare Center, Kaiser shipyards. Nicknamed 'Rosie the Riveters,' an estimated seven million women on the American home front joined the labor force at war production factories while the men were away fighting World War II. Therefore, the need for childcare became a necessity and an issue for both employee and employers.","3D","","<script async src='https://api.cappasity.com/api/player/cappasity-ai'></script><iframe width='100%' height='600px' frameborder='0' allowfullscreen mozallowfullscreen='true' webkitallowfullscreen='true' style='border:0;' src='https://api.cappasity.com/api/player/07b0d304-c5ac-4185-b1f4-409f1b157612/embedded?autorun=0&closebutton=1&logo=1&analytics=1&uipadx=0&uipady=0&enablestoreurl=0&storeurl=&hidehints=0&autorotate=0&autorotatetime=10&autorotatedelay=2&autorotatedir=1&hidefullscreen=1&hideautorotateopt=1&hidesettingsbtn=0&enableimagezoom=1&zoomquality=1&hidezoomopt=0&arbutton=1' ></iframe>","","Replica","c. 1943","unknown","Attic Artifacts: WWII Women; Rosie the Riveter","The General","IKEducation","World War II; home front; women; Attic Artifacts, children, Rosie the Riveter","","8.03"
"95","Westinghouse Baltimore employee badge","8.04WestinghouseBaltimoreIDbadge.png","This Westinghouse Baltimore Employee Badge measures 1.5 inches wide, and is missing its back pin. Badge is original. Photo is replica.","3D","","<script async src='https://api.cappasity.com/api/player/cappasity-ai'></script><iframe width='100%' height='600px' frameborder='0' allowfullscreen mozallowfullscreen='true' webkitallowfullscreen='true' style='border:0;' src='https://api.cappasity.com/api/player/072d4461-aaf1-4fbd-b7d1-0ddfedaee781/embedded?autorun=0&closebutton=1&logo=1&analytics=1&uipadx=0&uipady=0&enablestoreurl=0&storeurl=&hidehints=0&autorotate=0&autorotatetime=10&autorotatedelay=2&autorotatedir=1&hidefullscreen=1&hideautorotateopt=1&hidesettingsbtn=0&enableimagezoom=1&zoomquality=1&hidezoomopt=0&arbutton=1' ></iframe>","","Combination","c. 1943","unknown","Attic Artifacts: WWII Women; Rosie the Riveter","The General","IKEducation","World War II; home front; women; Attic Artifacts, children, Rosie the Riveter","","8.04"
"96","WWII Sons in Service flag","8.10bSonsInServiceFlag.png","This Sons in Service flag has one blue star, a gold tasseled rope tied to the display pole, and gold tassels across the bottom. Measures 8'W x 12' H.  During World Wars I and II, families of servicemen displayed flags to show support for their sons and husbands fighting overseas. According to the Blue Star Mothers of America Organization, the service flag was designed and patented by Army Captain Robert L. Qeisser. Each blue star on the flag represents a service member in active duty. A gold star is displayed if a service member is killed in action or dies in service. These flags were usually hand made by mothers or wives and were displayed in the window of their home. Those women are sometimes referred to as 'Blue or Gold Star Mothers or Wives.'","3D","","<script async src='https://api.cappasity.com/api/player/cappasity-ai'></script><iframe width='100%' height='600px' frameborder='0' allowfullscreen mozallowfullscreen='true' webkitallowfullscreen='true' style='border:0;' src='https://api.cappasity.com/api/player/03e55343-b283-4912-8dd3-3ebdc0fbb64f/embedded?autorun=0&closebutton=1&logo=1&analytics=1&uipadx=0&uipady=0&enablestoreurl=0&storeurl=&hidehints=0&autorotate=0&autorotatetime=10&autorotatedelay=2&autorotatedir=1&hidefullscreen=1&hideautorotateopt=1&hidesettingsbtn=0&enableimagezoom=1&zoomquality=1&hidezoomopt=0&arbutton=1' ></iframe>","","Original","c. 1941-1945","unknown","Attic Artifacts: WWII Women; Attic Artifacts: WWII Kids; Rosie the Riveter","The General","IKEducation","World War II; home front; women; Attic Artifacts, children, Rosie the Riveter","","8.10b"
"97","WWII Sons in Service flag","8.10aSonsInServiceFlag.png","This Sons in Service flag has two blue stars, a gold tasseled rope and a paper poppy affixed to one side of the display pole. Measures 8'W x 12' H. Circa 1941-45. During World Wars I and II, families of servicemen displayed flags to show support for their sons and husbands fighting overseas. According to the Blue Star Mothers of America Organization, the service flag was designed and patented by Army Captain Robert L. Qeisser. Each blue star on the flag represents a service member in active duty. A gold star is displayed if a service member is killed in action or dies in service. These flags were usually hand made by mothers or wives and were displayed in the window of their home.  Those women are sometimes referred to as 'Blue or Gold Star Mothers or Wives.' ","3D","","<script async src='https://api.cappasity.com/api/player/cappasity-ai'></script><iframe width='100%' height='600px' frameborder='0' allowfullscreen mozallowfullscreen='true' webkitallowfullscreen='true' style='border:0;' src='https://api.cappasity.com/api/player/3fc4bcda-bc83-4740-a4ab-0eeb3fecfa6b/embedded?autorun=0&closebutton=1&logo=1&analytics=1&uipadx=0&uipady=0&enablestoreurl=0&storeurl=&hidehints=0&autorotate=0&autorotatetime=10&autorotatedelay=2&autorotatedir=1&hidefullscreen=1&hideautorotateopt=1&hidesettingsbtn=0&enableimagezoom=1&zoomquality=1&hidezoomopt=0&arbutton=1' ></iframe>","","Original","c. 1941-1945","unknown","Attic Artifacts: WWII Women; Attic Artifacts: WWII Kids; Rosie the Riveter","The General","IKEducation","World War II; home front; women; Attic Artifacts, children, Rosie the Riveter","","8.10a"
"98","Answers to Questions Women Ask About War Work","8.18AnswerstoQuestionsWomenAskAboutWarWork.png","This booklet was originally created by the United States Employment Service of the War Manpower Commission. Date penciled on bottom of back cover is 2/6/47; possibly the day is was accessioned into the National Archives, Records of War Manpower Commission, Record Group 211. Its purpose was to explain to women why the government wants and needs them to work outside of the home and how it might effect their family.","3D","","<script async src='https://api.cappasity.com/api/player/cappasity-ai'></script><iframe width='100%' height='600px' frameborder='0' allowfullscreen mozallowfullscreen='true' webkitallowfullscreen='true' style='border:0;' src='https://api.cappasity.com/api/player/90537f31-b50a-46c9-8dfb-f1aee0957f51/embedded?autorun=0&closebutton=1&logo=1&analytics=1&uipadx=0&uipady=0&enablestoreurl=0&storeurl=&hidehints=0&autorotate=0&autorotatetime=10&autorotatedelay=2&autorotatedir=1&hidefullscreen=1&hideautorotateopt=1&hidesettingsbtn=0&enableimagezoom=1&zoomquality=1&hidezoomopt=0&arbutton=1' ></iframe>","","Replica","c. 1941-1945","United States Employment Service of the War Manpower Commission","Attic Artifacts: WWII Women; Rosie the Riveter","The General","IKEducation","World War II; home front; women; Attic Artifacts, children, Rosie the Riveter","Retrieved from Northern Illinois University Library: W.W. Embree Collection, RC 2, box 6, folder 47.","8.18"
"99","Bulletin 59, Effects of Alaska Statehood","AL1_Bulletin59_EffectsofAlaskaStatehoodAug4,1958.png","","PDF","AL1_Bulletin59_EffectsofAlaskaStatehoodAug4,1958.pdf","","","Original","Aug 4,1958","Maurice H. Sans","In Conclusion: Student Document Research; ","Presidency","Eisenhower Presidential Library","Alaska; Statehood; student research files ","DDE's Records as President, Official File, Box 630, OF-147-D Alaska (4); NAID #12012411","AL1"
"100","Operation Statehood","AL2_OperationStatehoodMay2,1954.png","","PDF","AL2_OperationStatehoodMay2,1954.pdf","","","Original","May 2, 1954","Barrie White","In Conclusion: Student Document Research; ","Presidency","Eisenhower Presidential Library","Alaska; Statehood; student research files ","DDE's Records as President, Official File, Box 629, OF-147-D Alaska (2); NAID #12010331","AL2"
"101","Letter to DDE from Attorney General","AL3_LettertoDDEfromAttyGen12_31_58.png","","PDF","AL3_LettertoDDEfromAttyGen12_31_58.pdf","","","Original","December 31, 1958","Williams P. Rogers","In Conclusion: Student Document Research; ","Presidency","Eisenhower Presidential Library","Alaska; Statehood; student research files ","DDE's Records as President, Official File, Box 630, OF-147-D Alaska (5); NAID #12012414","AL3"
"102","Letter to President from Henry Jackson","AL4_LettertoPresidentfromHenryJackson,3_19_55.png","","PDF","AL4_LettertoPresidentfromHenryJackson,3_19_55.pdf","","","Original","March 19, 1955","Henry M. Jackson","In Conclusion: Student Document Research; ","Presidency","Eisenhower Presidential Library","Alaska; Statehood; student research files ","DDE's Records as President, Official File, Box 630, OF-147-D-1 Alaskan Statehood (2); NAID #12010350","AL4"
"103","Cost of Statehood","AL5_SecretaryoftheInterior,June24,1958.png","","PDF","AL5_SecretaryoftheInterior,June24,1958.pdf","","","Original","June 24, 1958","Fred A. Seaton","In Conclusion: Student Document Research; ","Presidency","Eisenhower Presidential Library","Alaska; Statehood; student research files ","DDE's Papers as President, Administration Series, Box 32, Seaton, Fred (2); NAID #12012381","AL5"
"104","Letter to DDE from Barrie White","AL6_LettertoDDEfromBarrieWhite5_27_54.png","","PDF","AL6_LettertoDDEfromBarrieWhite5_27_54.pdf","","","Original","May 27, 1954","Barrie White","In Conclusion: Student Document Research; ","Presidency","Eisenhower Presidential Library","Alaska; Statehood; student research files ","DDE's Records as President, Official File, Box 629, OF-147-D Alaska (2); NAID #12010334","AL6"
"105","Problems Arising from Alaska Statehood","AL7_lettertoDDEReproblemsarisingfromAlaskastatehood,7_17_58.png","","PDF","AL7_lettertoDDEReproblemsarisingfromAlaskastatehood,7_17_58.pdf","","","Original","July 17, 1958","Maurice H. Sans","In Conclusion: Student Document Research; ","Presidency","Eisenhower Presidential Library","Alaska; Statehood; student research files ","DDE's Records as President, Official File, Box 629, OF-147-D Alaska (4); NAID #12012409","AL7"
"106","Approval of H.R. 7999","AL8_LettersfromDDEJuly7,1958.png","","PDF","AL8_LettersfromDDEJuly7,1958.pdf","","","Original","July 7, 1958","Dwight D. Eisenhower","In Conclusion: Student Document Research; ","Presidency","Eisenhower Presidential Library","Alaska; Statehood; student research files ","DDE's Records as President, Official File, Box 630, OF-147-D Alaska (4); NAID #12012406","AL8"
"107","Letter to Senator Henry Jackson","AL9_letter,fromDDEtoSenatorJackson,3_31_55.png","","PDF","AL9_letter,fromDDEtoSenatorJackson,3_31_55.pdf","","","Original","March 31, 1955","Dwight D. Eisenhower","In Conclusion: Student Document Research; ","Presidency","Eisenhower Presidential Library","Alaska; Statehood; student research files ","DDE's Records as President, Official File, Box 630, OF-147-D-1 Alaskan Statehood (2); NAID #12010352","AL9"
"108","Alaskan Delegation","AL10_MemofromTheDeptoftheInteriortoMrStephens,5_13_54.png","","PDF","AL10_MemofromTheDeptoftheInteriortoMrStephens,5_13_54.pdf","","","Original","May 13, 1954","Orme Lewis","In Conclusion: Student Document Research; ","Presidency","Eisenhower Presidential Library","Alaska; Statehood; student research files ","DDE's Records as President, Official File, Box 629, OF-147-D Alaska (2); NAID #12010332","AL10"
"109","Ceremony Guest List","AL11_ListofpersonsattendingThesigningceremony,1_3_57.png","","PDF","AL11_ListofpersonsattendingThesigningceremony,1_3_57.pdf","","","Original","January 3, 1957","No Author","In Conclusion: Student Document Research; ","Presidency","Eisenhower Presidential Library","Alaska; Statehood; student research files ","DDE's Records as President, Official File, Box 630, OF 147-D Alaska (5); NAID #12012416","AL11"
"110","Time of Admission","AL12_ MemoconcerningthetimeofadmissionofthestateofAlaska,12_31_58.png","","PDF","AL12_MemoconcerningthetimeofadmissionofthestateofAlaska,12_31_58.pdf","","","Original","December 31, 1958","William P. Rogers","In Conclusion: Student Document Research; ","Presidency","Eisenhower Presidential Library","Alaska; Statehood; student research files ","DDE's Records as President, Official File, Box 630, OF-147-D Alaska (5); NAID #12012415","AL12"
"111","Administration's Position on Alaska","AL13_MemoonImplementationoftheAdministrationspositiononAlaskastatehood,3_6_57.png","","PDF","AL13_MemoonImplementationoftheAdministrationspositiononAlaskastatehood,3_6_57.pdf","","","Original","March 6, 1957","Legislative Counsel","In Conclusion: Student Document Research; ","Presidency","Eisenhower Presidential Library","Alaska; Statehood; student research files ","[DDE's Records as President, Official File, Box 630, OF-147-D-1 Alaskan Statehood (2); NAID #12010354","AL13"
"112","Alaska Delegation","AL14_list,REAlaskadelegation.5_13_54.png","","PDF","AL14_list,REAlaskadelegation.5_13_54.pdf","","","Original","May 13, 1954","Orme Lewis","In Conclusion: Student Document Research; ","Presidency","Eisenhower Presidential Library","Alaska; Statehood; student research files ","DDE's Records as President, Official File, Box 629, OF-147-D Alaska (2); NAID #12010333","AL14"
"113","Statement of the Secretary of the Interior","AL15_statementofthesecretaryoftheinterioronAlaskanStatehood,7_1_58.png","","PDF","AL15_statementofthesecretaryoftheinterioronAlaskanStatehood,7_1_58.pdf","","","Original","July 1, 1958","Fred Seaton","In Conclusion: Student Document Research; ","Presidency","Eisenhower Presidential Library","Alaska; Statehood; student research files ","DDE's Records as President, Official File, Box 630, OF-147-D Alaska (4); NAID #12012401","AL15"
