"216","Letter, President Eisenhower to Rev. Billy Graham","CRP7.Letter,DDEtoRev.Graham,March30,1956.png","","PDF","CRP7.Letter,DDEtoRev.Graham,March30,1956.pdf","","","Original","March 30, 1956","Dwight D. Eisenhower","In Conclusion: Student Document Research","Presidency","Eisenhower Presidential Library","Civil Rights; segregation; desegregation","DDE's Papers as President, Name Series, Box 16, Billy Graham; NAID #12175800","CRP7"
"217","Letter, Rev. Billy Graham to President Eisenhower","CRP8.Letter,Rev.GrahamtoDDE,June4,1956.png","","PDF","CRP8.Letter,Rev.GrahamtoDDE,June4,1956.pdf","","","Original","June 4, 1956","Rev. Billy Graham","In Conclusion: Student Document Research","Presidency","Eisenhower Presidential Library","Civil Rights; segregation; desegregation","DDE's Papers as President, Name Series, Box 16, Billy Graham; NAID #12175836","CRP8"
"218","Dwight D. EIsenhower Diary Entry","CRP9.DiaryEntry,Aug14,1956.png","","PDF","CRP9.DiaryEntry,Aug14,1956.pdf","","","Original","August 14, 1956","Dwight D. Eisenhower","In Conclusion: Student Document Research","Presidency","Eisenhower Presidential Library","Civil Rights; segregation; desegregation","DDE’s Papers as President, Ann Whitman Diary Series, Box 8, August 1956 Diary (1); NAID #12191456","CRP9"
"219","Cover Letter by J. Edgar Hoover for 'The Communist Party and the Negro'","CRP10.Letter,J.EdgarHoovertoJackson,Oct24,1956.png","","PDF","CRP10.Letter,J.EdgarHoovertoJackson,Oct24,1956.pdf","","","Original","October 24, 1956","J. Edgar Hoover; ","In Conclusion: Student Document Research","Presidency","Eisenhower Presidential Library","Civil Rights; segregation; desegregation","OSANSA, FBI Series, Box 10, The Communist Party and the Negro Oct. 1956; NAID #12191457","CRP10"
"220","Report, The Communist Party and the Negro","CRP11.TheCommunistPartyandtheNegro.png","","PDF","CRP11.TheCommunistPartyandtheNegro.pdf","","","Original","October 1956","Federal Bureau of Investigation","In Conclusion: Student Document Research","Presidency","Eisenhower Presidential Library","Civil Rights; segregation; desegregation","OSANSA, FBI Series, Box 10, The Communist Party and the Negro Oct. 1956; NAID #12191457","CRP11"
"221","Letter, Adam Clayton Powell to DDE","CRP12.Letter,PowelltoDDE,March28,1957.png","","PDF","CRP12.Letter,PowelltoDDE,March28,1957.pdf","","","Original","March 28, 1957","Adam Clayton Powell","In Conclusion: Student Document Research","Presidency","Eisenhower Presidential Library","Civil Rights; segregation; desegregation","DDE’s Records as President, Official File, Box 614, OF-142-A Negro Matters-Colored Question (4); NAID #12175863","CRP12"
"222","Memorandum, Maxwell Rabb to Sherman Adams","CRP13.Memo,RabbtoAdams,April17,1957.png","","PDF","CRP13.Memo,RabbtoAdams,April17,1957.pdf","","","Original","April 17, 1957","Maxwell M. Raab","In Conclusion: Student Document Research","Presidency","Eisenhower Presidential Library","Civil Rights; segregation; desegregation","DDE’s Records as President, Official File, Box 614, OF-142-A Negro Matters-Colored Question (4); NAID #12176489","CRP13"
"223","Memorandum, E. Frederic Morrow to Sherman Adams","CRP14.Memo,MorrowtoAdams,June4,1957.png","","PDF","CRP14.Memo,MorrowtoAdams,June4,1957.pdf","","","Original","June 4, 1957","E. Frederic Morrow","In Conclusion: Student Document Research","Presidency","Eisenhower Presidential Library","Civil Rights; segregation; desegregation","DDE’s Records as President, Official File, Box 614, OF-142-A Negro Matters-Colored Question (5); NAID #12191287","CRP14"
"224","Memorandum, Maxwell Rabb to Sherman Adams","CRP15.Memo,RabbtoAdams,June24,1957.png","","PDF","CRP15.Memo,RabbtoAdams,June24,1957.pdf","","","Original","June 24, 1957","Maxwell M. Raab","In Conclusion: Student Document Research","Presidency","Eisenhower Presidential Library","Civil Rights; segregation; desegregation","DDE’s Records as President, Official File, Box 614, OF-142-A Negro Matters-Colored Question (5); NAID #12176961","CRP15"
"225","Memorandum for the Record, Meeting of Negro Leaders with the President June 23, 1958","CRP16.MeetingofNegroLeaderswiththePresidentJune23,1958.png","","PDF","CRP16.MeetingofNegroLeaderswiththePresidentJune23,1958.pdf","","","Original","June 23, 1958","Rocco C. Siciliano","In Conclusion: Student Document Research","Presidency","Eisenhower Presidential Library","Civil Rights; segregation; desegregation","DDE’s Records as President, Official File, Box 614, OF-142-A Negro Matters-Colored Question (5); NAID #12177477","CRP16"
"226","Memorandum, Maxwell Rabb to Sherman Adams","CRP17.Memo,RabbtoAdams,Nov12,1957.png","","PDF","CRP17.Memo,RabbtoAdams,Nov12,1957.pdf","","","Original","November 12, 1957","Maxwell M. Raab","In Conclusion: Student Document Research","Presidency","Eisenhower Presidential Library","Civil Rights; segregation; desegregation","E. Frederic Morrow Records, Box 10, Civil Rights Commission; NAID #12190135","CRP17"
"227","Memorandum for the Record, Meeting of Negro Leaders with the President","CRP18.Memo,MtgofNegroLeaderswithDDE,June24,1958.png","","PDF","CRP18.Memo,MtgofNegroLeaderswithDDE,June24,1958.pdf","","","Original","June 24, 1958","Rocco C. Siciliano","In Conclusion: Student Document Research","Presidency","Eisenhower Presidential Library","Civil Rights; segregation; desegregation","DDE's Papers as President, DDE Diary Series, Box 33, June 1958 Staff Notes (2); NAID #186611","CRP18"
"228","Statement to President Eisenhower","CRP19.StatementtoDDE,June24,1958.png","","PDF","CRP19.StatementtoDDE,June24,1958.pdf","","","Original","June 23, 1958","A. Philip Randolph; Lester B. Granger; Rev. Martin Luther King","In Conclusion: Student Document Research","Presidency","Eisenhower Presidential Library","Civil Rights; segregation; desegregation","DDE's Papers as President, DDE Diary Series, Box 33, June 1958 Staff Notes (2); NAID #186611","CRP19"
"229","Letter, Roy Wilkins (NAACP) to President Eisenhower","CRP20.Letter,WilkinstoDDE,June25,1958.png","","PDF","CRP20.Letter,WilkinstoDDE,June25,1958.pdf","","","Original","June 25, 1958","Roy Wilkins","In Conclusion: Student Document Research","Presidency","Eisenhower Presidential Library","Civil Rights; segregation; desegregation","DDE’s Records as President, Official File, Box 614, OF-142-A Negro Matters-Colored Question (6); NAID #12189441","CRP20"
"230","Memorandum, Rocco Siciliano to President Eisenhower","CRP21.Memo,SicilianotoDDE,June25,1958.png","","PDF","CRP21.Memo,SicilianotoDDE,June25,1958.pdf","","","Original","June 25, 1958","Rocco C. Siciliano","In Conclusion: Student Document Research","Presidency","Eisenhower Presidential Library","Civil Rights; segregation; desegregation","DDE’s Papers as President, DDE Diary Series, Box 33, June 1958 Staff Notes (2); NAID #12188975","CRP21"
"231","Letter, President Eisenhower to Ralph McGill","CRP22.Letter,DDEtoMcGill,Feb26,1959.png","","PDF","CRP22.Letter,DDEtoMcGill,Feb26,1959.pdf","","","Original","February 26, 1959","Dwight D. Eisenhower","In Conclusion: Student Document Research","Presidency","Eisenhower Presidential Library","Civil Rights; segregation; desegregation","DDE’s Papers as President, DDE Diary Series, Box 39, DDE Dictation February 1959; NAID #12188395","CRP22"
"232","Civl Defense All Purpose Survival Crackers","11.01SurvivalCrackers.jpg","An early version of the survival cracker project was launched in 1955 by President Eisenhower’s Federal Civil Defense Administration. Named “Grandma’s Pantry,” under the justification that Grandma was always prepared for unexpected company, the program called for each household to have a ready supply of food and water in case of attack. In response, the Eisenhower administration looked to develop a food that was nutritious, cheap, easy to eat, shelf-stable, and reproducible on a mass scale. All other attributes, including taste, would be disregarded in favor of the ultimate survival food, one that could be stored underground indefinitely. The general public began to stock up on such products, like this tin of Survival Crackers. ","3D","","<script async src='https://api.cappasity.com/api/player/cappasity-ai'></script><iframe width='100%' height='600px' frameborder='0' allowfullscreen mozallowfullscreen='true' webkitallowfullscreen='true' style='border:0;' src='https://api.cappasity.com/api/player/5c5bbc13-6b87-4a81-8aea-d834c33c5326/embedded?autorun=0&closebutton=1&logo=1&analytics=1&uipadx=0&uipady=0&enablestoreurl=0&storeurl=&hidehints=0&autorotate=0&autorotatetime=10&autorotatedelay=2&autorotatedir=1&hidefullscreen=1&hideautorotateopt=1&hidesettingsbtn=0&enableimagezoom=1&zoomquality=1&hidezoomopt=0&arbutton=1' ></iframe>","","Original","c.1960","National Bisquick Co.","Duck and Cover","Presidency","IKEducation","Duck and Cover; Emergency Supplies; fallout shelter; Civil Defense; Bomb Shelter; Survival Crackers","","11.01"
"233","Emergency Drinking Water","11.02EmergencyWater.png","Under the threat of nuclear war, Americans were encouraged to build fall out shelters and stockpile supplies to survive underground. This can reads: 'Property of US Govt.; Contents 10-10 1/2 oz; Emergency Drinking Water; Contract No NY 73669-62; Spec No MIL-15117B; H&M Packing Corporation; Glendale California.' It measures approximately 4.875 inches high and has a diameter of 2.688 inches.","3D","","<script async src='https://api.cappasity.com/api/player/cappasity-ai'></script><iframe width='100%' height='600px' frameborder='0' allowfullscreen mozallowfullscreen='true' webkitallowfullscreen='true' style='border:0;' src='https://api.cappasity.com/api/player/57df7730-93f1-4c95-a49a-62761e6d9858/embedded?autorun=0&closebutton=1&logo=1&analytics=1&uipadx=0&uipady=0&enablestoreurl=0&storeurl=&hidehints=0&autorotate=0&autorotatetime=10&autorotatedelay=2&autorotatedir=1&hidefullscreen=1&hideautorotateopt=1&hidesettingsbtn=0&enableimagezoom=1&zoomquality=1&hidezoomopt=0&arbutton=1' ></iframe>","","Original","1962","H&M Packing Corporation, Glendale California","Duck and Cover","Presidency","IKEducation","Duck and Cover; Emergency Supplies; fallout shelter; Civil Defense; Bomb Shelter; Emergency Water","","11.02"
"234","Dosimeter Pens","11.03abDosimeterPens.png","Under the threat of nuclear war in the 1950s and 60s, Americans prepared for what life might be like if they survived an attack. The dosimeter is a pen-size scientific instrument with an eyepiece you look into at the top of the dosimeter and a charging contact at the bottom. Inside the device is a microscopic scale with a hairline indicator. This shows the amount of radiation absorbed by the device since the last time it was reset to zero. The dosimeter is reset by charging it with electricity using with a dosimeter charger (also found in the primary source library). This instrument measured the amount of radiation (roentgen) that objects might have. This CD V-742 was a direct-reading (self-reading) pocket dosimeter that measured exposures from 0 – 200 roentgen (R). The CDV-742 can be identified by its bronze or gold colored pocket clip. The CDV-742 high range dosimeter is the standard for use in shelter, WER [Weapons Effects Reporting] Stations, emergency service organizations and vital facilities. They would also be used by the millions of civil preparedness workers that would be needed for recovery operations during the postattack period when emergence from shelter is possible. It measures 4.25' long and 0.5' diameter.","3D","","<script async src='https://api.cappasity.com/api/player/cappasity-ai'></script><iframe width='100%' height='600px' frameborder='0' allowfullscreen mozallowfullscreen='true' webkitallowfullscreen='true' style='border:0;' src='https://api.cappasity.com/api/player/13198ef0-b3ce-40be-ac8a-9c9c891c6272/embedded?autorun=0&closebutton=1&logo=1&analytics=1&uipadx=0&uipady=0&enablestoreurl=0&storeurl=&hidehints=0&autorotate=0&autorotatetime=10&autorotatedelay=2&autorotatedir=1&hidefullscreen=1&hideautorotateopt=1&hidesettingsbtn=0&enableimagezoom=1&zoomquality=1&hidezoomopt=0&arbutton=1' ></iframe>","","Original","c.1959","Bendix","Duck and Cover","Presidency","IKEducation","Duck and Cover; Emergency Supplies; fallout shelter; Civil Defense; Bomb Shelter; Dosimeter Pen; radiation","","11.03ab"
"235","Dosimeter Charger","11.03cDosimeterCharger.png","Under the threat of nuclear war in the 1950s and 60s, Americans prepared for what life might be like if they survived an attack. The dosimeter is a pen-size scientific instrument with an eyepiece you look into at the top of the dosimeter and a charging contact at the bottom (also found in our primary souce library). It measures the amount of radiation absorbed by the device since the last time it was reset to zero.The dosimeter is reset by charging it with electricity using with a dosimeter charger, like this one. This device fills the inner chamber of the dosimeter tube with a high voltage charge. By looking through the eyepiece while this is being done, the user can manipulate the charger knob to reset the hairline indicator on the radiation scale inside the dosimeter to the '0' point. This sets the dosimeter to zero and readies it for use.","3D","","<script async src='https://api.cappasity.com/api/player/cappasity-ai'></script><iframe width='100%' height='600px' frameborder='0' allowfullscreen mozallowfullscreen='true' webkitallowfullscreen='true' style='border:0;' src='https://api.cappasity.com/api/player/d478ca32-9cab-4cc5-8cfc-e7a0b12e4bfd/embedded?autorun=0&closebutton=1&logo=1&analytics=1&uipadx=0&uipady=0&enablestoreurl=0&storeurl=&hidehints=0&autorotate=0&autorotatetime=10&autorotatedelay=2&autorotatedir=1&hidefullscreen=1&hideautorotateopt=1&hidesettingsbtn=0&enableimagezoom=1&zoomquality=1&hidezoomopt=0&arbutton=1' ></iframe>","","Original","c. 1960","Jordan Electronics, A Division of the Victoreen Instrument Co., Alhambra, California","Duck and Cover","Presidency","IKEducation","Duck and Cover; Emergency Supplies; fallout shelter; Civil Defense; Bomb Shelter; Dosimeter Charger; radiation","","11.03c"
"236","Dosimter Manual","11.03dDosimeter Manual.png","Under the threat of nuclear war in the 1950s and 60s, Americans prepared for what life might be like if they survived an attack. This manual was used to explain how to use a dosimeter pen and charger (these items can also be found in our primary source library). The dosimeter penwas used to measure the amount of radiation with which it comes in contact.","3D","","<script async src='https://api.cappasity.com/api/player/cappasity-ai'></script><iframe width='100%' height='600px' frameborder='0' allowfullscreen mozallowfullscreen='true' webkitallowfullscreen='true' style='border:0;' src='https://api.cappasity.com/api/player/d478ca32-9cab-4cc5-8cfc-e7a0b12e4bfd/embedded?autorun=0&closebutton=1&logo=1&analytics=1&uipadx=0&uipady=0&enablestoreurl=0&storeurl=&hidehints=0&autorotate=0&autorotatetime=10&autorotatedelay=2&autorotatedir=1&hidefullscreen=1&hideautorotateopt=1&hidesettingsbtn=0&enableimagezoom=1&zoomquality=1&hidezoomopt=0&arbutton=1' ></iframe>","","Original","c. 1960","Jordan Electronics, A Division of the Victoreen Instrument Co., Alhambra, California","Duck and Cover","Presidency","IKEducation","Duck and Cover; Emergency Supplies; fallout shelter; Civil Defense; Bomb Shelter; Dosimeter Manual; radiation","","11.03d"
"237","Emerson Radio","11.07bEmersonRadio.png","Red bakelite Emerson radio","3D","","<script async src='https://api.cappasity.com/api/player/cappasity-ai'></script><iframe width='100%' height='600px' frameborder='0' allowfullscreen mozallowfullscreen='true' webkitallowfullscreen='true' style='border:0;' src='https://api.cappasity.com/api/player/0b967e50-01a1-48b3-8bdc-9ed1dbd27ff4/embedded?autorun=0&closebutton=1&logo=1&analytics=1&uipadx=0&uipady=0&enablestoreurl=0&storeurl=&hidehints=0&autorotate=0&autorotatetime=10&autorotatedelay=2&autorotatedir=1&hidefullscreen=1&hideautorotateopt=1&hidesettingsbtn=0&enableimagezoom=1&zoomquality=1&hidezoomopt=0&arbutton=1' ></iframe>","","Original","c.1950","Emerson","Duck and Cover","Presidency","IKEducation","Duck and Cover; Emergency Supplies; fallout shelter; Civil Defense; Bomb Shelter; radio","","11.07b"
"238","Pocket Knife","11.20PocketKnife.png","A pocketknife is a small foldable knife with more blades or tools that fit inside the handle.","3D","","<script async src='https://api.cappasity.com/api/player/cappasity-ai'></script><iframe width='100%' height='600px' frameborder='0' allowfullscreen mozallowfullscreen='true' webkitallowfullscreen='true' style='border:0;' src='https://api.cappasity.com/api/player/bff9df76-3362-4e19-9fef-b811123e7f32/embedded?autorun=0&closebutton=1&logo=1&analytics=1&uipadx=0&uipady=0&enablestoreurl=0&storeurl=&hidehints=0&autorotate=0&autorotatetime=10&autorotatedelay=2&autorotatedir=1&hidefullscreen=1&hideautorotateopt=1&hidesettingsbtn=0&enableimagezoom=1&zoomquality=1&hidezoomopt=0&arbutton=1' ></iframe>","","Original","unkown","unknown","Duck and Cover","Presidency","IKEducation","Duck and Cover; Emergency Supplies; fallout shelter; Civil Defense; Bomb Shelter; radio","","11.2"
"239","Sanitation Kit","11.16SanitationKit.png","Under the threat of nuclear war, Americans were encouraged to build fall out shelters and stockpile supplies to survive underground. This is a SK IV Sanitation Kit along with some of its original contents: toilet seat, toilet paper, liner, plastic gloves. Other items that were originally in there, but have been removed, are listed on the front of the kit/barrel. ","3D","","<script async src='https://api.cappasity.com/api/player/cappasity-ai'></script><iframe width='100%' height='600px' frameborder='0' allowfullscreen mozallowfullscreen='true' webkitallowfullscreen='true' style='border:0;' src='https://api.cappasity.com/api/player/204e05ba-fd03-4829-a8b1-0c4a3722a213/embedded?autorun=0&closebutton=1&logo=1&analytics=1&uipadx=0&uipady=0&enablestoreurl=0&storeurl=&hidehints=0&autorotate=0&autorotatetime=10&autorotatedelay=2&autorotatedir=1&hidefullscreen=1&hideautorotateopt=1&hidesettingsbtn=0&enableimagezoom=1&zoomquality=1&hidezoomopt=0&arbutton=1' ></iframe>","","Original","1963","Office of Civil defense and the Department of Defense. ","Duck and Cover","Presidency","IKEducation","Duck and Cover; Emergency Supplies; fallout shelter; Civil Defense; Bomb Shelter; sanitation kit","","11.16"
"240","Safety Notification Card","11.05SafetyNotificationCard.png","Under the threat of nuclear war in the 1950s and 60s, Americans prepared for what life might be like if they survived an attack. These cards were for distributed for Americans to 'fill out and mail immediately after evacuation to any person who might be concerned about your safety.' The card would provide information regarding where people were relocated.","3D","","<script async src='https://api.cappasity.com/api/player/cappasity-ai'></script><iframe width='100%' height='600px' frameborder='0' allowfullscreen mozallowfullscreen='true' webkitallowfullscreen='true' style='border:0;' src='https://api.cappasity.com/api/player/b85aa35e-8e18-4667-90d7-7c0f6352e80c/embedded?autorun=0&closebutton=1&logo=1&analytics=1&uipadx=0&uipady=0&enablestoreurl=0&storeurl=&hidehints=0&autorotate=0&autorotatetime=10&autorotatedelay=2&autorotatedir=1&hidefullscreen=1&hideautorotateopt=1&hidesettingsbtn=0&enableimagezoom=1&zoomquality=1&hidezoomopt=0&arbutton=1' ></iframe>","","Original","February, 1959","U.S. Post Office and Office of Civil Defense","Duck and Cover","Presidency","IKEducation","Duck and Cover; Emergency Supplies; fallout shelter; Civil Defense; Bomb Shelter; Safety Notification Card","","11.05"
"241","DDE Addresses the Little Rock Situation","AU8.LittleRockSituation.jpg","President Eisenhower adressed the American people regarding the school desegregation situation happening in Little Rock, Arkansas.","audio","AU8.LittleRockSituation.mp3","","","Original","September 24, 1957","Dwight D. Eisenhower","In Conclusion: Student Document Research","Presidency","Eisenhower Presidential Library","Civil Rights; segregation; desegregation","Audio recording: 1/4 in. open reel; Presidential Series: Press Conferences, Impromptu Remarks, and Radio Addresses; EL-D16-89","AU8"
"242","Telegram from Chicago Defender to President Eisenhower","CRE01.Telegram,ChicagoDefendertoDDE,09_01_1955.png","","PDF","CRE01.Telegram,ChicagoDefendertoDDE,09_01_1955.pdf","","","Original","September 1, 1955","Chicago Defender'","In Conclusion: Student Document Research","Presidency","Eisenhower Presidential Library","Civil Rights; segregation; desegregation; Emmitt Till","DDE's Records as President, Alphabetical File, Box 3113, Emmett Till; NAID #12192715","CRE01"
"243","Reply to Chicago Defender from J. William Barba","CRE2.Letter,BarbatoSengstacke,9_2_1955.PNG","","PDF","CRE2.Letter,BarbatoSengstacke,9_2_1955.PDF","","","Original","September 2, 1955","J. William Barba","In Conclusion: Student Document Research","Presidency","Eisenhower Presidential Library","Civil Rights; segregation; desegregation; Emmitt Till","DDE's Records as President, Alphabetical File, Box 3113, Emmett Till; NAID #12196600","CRE2"
"244","Telegram from Mamie Bradley (mother of Emmett Till) to President Eisenhower","CRE3.telegram,BradleytoDDE,9_2_1955.png","","PDF","CRE3.telegram,BradleytoDDE,9_2_1955.pdf","","","Original","September 2, 1955","Mamie Bradley","In Conclusion: Student Document Research","Presidency","Eisenhower Presidential Library","Civil Rights; segregation; desegregation; Emmitt Till","DDE's Records as President, Alphabetical File, Box 3113, Emmett Till; NAID #12196780","CRE3"
"245","List of Letters from Sherman Adams to Department of Justice","CRE4.ListofLetterstoDDE,AdamstoDOJ,9_6_1955.png","","PDF","CRE4.ListofLetterstoDDE,AdamstoDOJ,9_6_1955.pdf","","","Original","September 6, 1955","Sherman Adams","In Conclusion: Student Document Research","Presidency","Eisenhower Presidential Library","Civil Rights; segregation; desegregation; Emmitt Till","DDE's Records as President, Alphabetical File, Box 3113, Emmett Till; NAID #12197846","CRE4"
"246","Letter from J. Edgar Hoover to Dillon Anderson","CRE5.letter,HoovertoAnderson,9_6_1955-09-06.png","","PDF","CRE5.letter,HoovertoAnderson,9_6_1955-09-06.pdf","","","Original","September 6, 1955","J. Edgar Hoover ","In Conclusion: Student Document Research","Presidency","Eisenhower Presidential Library","Civil Rights; segregation; desegregation; Emmitt Till","White House Office of the Special Assistant for National Security Affairs, FBI Series, Box 3, FBI T-Z (1); NAID #12209236","CRE5"
"247","Memo from Maxwell Rabb, RE: Communist leader 'Lightfoot'","CRE6.Memo,Maxwell,09_12_1955.png","","PDF","CRE6.Memo,Maxwell,09_12_1955.pdf","","","Original","September 12, 1955","Maxwell M. Raab","In Conclusion: Student Document Research","Presidency","Eisenhower Presidential Library","Civil Rights; segregation; desegregation; Emmitt Till","Maxwell Rabb Papers, Box 51, Mississippi; NAID #12224549","CRE6"
"248","Letter from J. Edgar Hoover to Dillon Anderson","CRE7.Letter,HoovertoAnderson,9_13_1955.png","","PDF","CRE7.Letter,HoovertoAnderson,9_13_1955.pdf","","","Original","September 13, 1955","J. Edgar Hoover ","In Conclusion: Student Document Research","Presidency","Eisenhower Presidential Library","Civil Rights; segregation; desegregation; Emmitt Till","White House Office of the Special Assistant for National Security Affairs, FBI Series, Box 3, FBI T-Z (1); NAID #12209235","CRE7"
"249","Night letter from the Brotherhood of Sleeping Car Porters to Attorney General Brownell","CRE8.Letter,BrotherhoodtoBrownell,09_28_1955.png","","PDF","CRE8.Letter,BrotherhoodtoBrownell,09_28_1955.pdf","","","Original","September 28, 1955","Brotherhood of Sleeping Car Porters","In Conclusion: Student Document Research","Presidency","Eisenhower Presidential Library","Civil Rights; segregation; desegregation; Emmitt Till","DDE's Records as President, Alphabetical File, Box 3113, Emmett Till; NAID #12196988","CRE8"
"250","Memo from National Administrative Committee re: Emmett Louis Till Lynching","CRE9.Memo,NACtoAllDistricts,09_29_1955.PNG","","PDF","CRE9.Memo,NACtoAllDistricts,09_29_1955.PDF","","","Original","September 29, 1955","National Administrative Committee","In Conclusion: Student Document Research","Presidency","Eisenhower Presidential Library","Civil Rights; segregation; desegregation; Emmitt Till","White House Office of the Special Assistant for National Security Affairs, FBI Series, Box 3, FBI T-Z (1); NAID #12224523","CRE9"
"251","Letter from the Publisher of Pittsburgh Courier to E. Frederic Morrow","CRE10.Letter,PittsburghCouriertoMorrow,9_29_1955.png","","PDF","CRE10.Letter,PittsburghCouriertoMorrow,9_29_1955.pdf","","","Original","September 29, 1955","W. Beverly Carter","In Conclusion: Student Document Research","Presidency","Eisenhower Presidential Library","Civil Rights; segregation; desegregation; Emmitt Till","DDE's Records as President, Alphabetical File, Box 3113, Emmett Till; NAID #12197279","CRE10"
"252","Letter from J. Edgar Hoover to Dillon Anderson","CRE11.LetterfromHoovertoDillon,10_11_1955.png","","PDF","CRE11.LetterfromHoovertoDillon,10_11_1955.pdf","","","Original","October 11, 1955","J. Edgar Hoover ","In Conclusion: Student Document Research","Presidency","Eisenhower Presidential Library","Civil Rights; segregation; desegregation; Emmitt Till","White House Office of the Special Assistant for National Security Affairs, FBI Series, Box 3, FBI T-Z (1); NAID #12224527","CRE11"
