"401","Memo for the Record","U229.MemoForRecord_June2_1960.png","","PDF","U229.MemoForRecord_June2_1960.pdf","","","Original","June 2, 1960","A.J. Goodpaster","In Conclusion: Student Document Research ","Presidency","Eisenhower Presidential Library","U-2; reconnaissance; Cold War; overflights; spy plane; Francis Gary Powers; Parris Summit; spies; espionage; U-2 spy plane","Christian Herter Papers, Box 20, U-2 (2); NAID #12010099","U229"
"402","State Department telegram","U230.TelegramStateDept_July28_1960.png","This telegram concerns coordination with British on U.S. reconnaissance flights.","PDF","U230.TelegramStateDept_July28_1960.pdf","","","Original","July 28, 1960","","In Conclusion: Student Document Research ","Presidency","Eisenhower Presidential Library","U-2; reconnaissance; Cold War; overflights; spy plane; Francis Gary Powers; Parris Summit; spies; espionage; U-2 spy plane","Office of the Staff Secretary, Subject Series, Alphabetical Subseries, Box 15, Intelligence Matters (15); NAID #12010103","U230"
"403","CIA Memo","U231.CIAMemo_Aug18_1960.png","This memo includes a list of overflights of the Soviet Bloc","PDF","U231.CIAMemo_Aug18_1960.pdf","","","Original","August 18, 1960","Allen Dulles","In Conclusion: Student Document Research ","Presidency","Eisenhower Presidential Library","U-2; reconnaissance; Cold War; overflights; spy plane; Francis Gary Powers; Parris Summit; spies; espionage; U-2 spy plane","Office of the Staff Secretary, Subject Series, Alphabetical Subseries, Box 15, Intelligence Matters (17); NAID #12008946","U231"
"404","Radio Interview with Drew Pearson of Washington Post","U232.RadioInt_Aug23_1960.png","","PDF","U232.RadioInt_Aug23_1960.pdf","","","Original","August 23, 1960","Patty Cavin conducted the interview","In Conclusion: Student Document Research ","Presidency","Eisenhower Presidential Library","U-2; reconnaissance; Cold War; overflights; spy plane; Francis Gary Powers; Parris Summit; spies; espionage; U-2 spy plane","Office of the Staff Secretary, Subject Series, Alphabetical Subseries, Box 15, Intelligence Matters (17); NAID #12009418","U232"
"405","Memo from the President","U233.MemoFrom DDE_Aug26_1960.png","This memo concerns the handling of satellite reconnaissance products.","PDF","U233.MemoFrom DDE_Aug26_1960.pdf","","","Original","August 26, 1960","Dwight D. Eisenhower","In Conclusion: Student Document Research ","Presidency","Eisenhower Presidential Library","U-2; reconnaissance; Cold War; overflights; spy plane; Francis Gary Powers; Parris Summit; spies; espionage; U-2 spy plane","Office of the Staff Secretary, Subject Series, Alphabetical Subseries, Box 15, Intelligence Matters (17); NAID #12008951","U233"
"406","Memorandum of Conference with the President","U234.MemoConfWithPres_Sept6_1960.png","This memo concerns Soviet fighter capability.","PDF","U234.MemoConfWithPres_Sept6_1960.pdf","","","Original","September 6, 1960","John S.D. Eisnhower","In Conclusion: Student Document Research ","Presidency","Eisenhower Presidential Library","U-2; reconnaissance; Cold War; overflights; spy plane; Francis Gary Powers; Parris Summit; spies; espionage; U-2 spy plane","Office of the Staff Secretary, Subject Series, Alphabetical Subseries, Box 15, Intelligence Matters (18); NAID #17368600","U234"
"407","CIA Comments on True Magazine Article","U235.CIAComments_TRUEArt_Sept1960.png","","PDF","U235.CIAComments_TRUEArt_Sept1960.pdf","","","Original","September 1960","U.S. Central Intelligence Agency","In Conclusion: Student Document Research ","Presidency","Eisenhower Presidential Library","U-2; reconnaissance; Cold War; overflights; spy plane; Francis Gary Powers; Parris Summit; spies; espionage; U-2 spy plane","Office of the Staff Secretary, Subject Series, Alphabetical Subseries, Box 15, Intelligence Matters (19); NAID #12010102","U235"
"408","Transcript of Press Conference","NS01.TranscriptOfPressConf_Oct9_1957.png","This portion of the press conference concerns the launching of Soviet satellite, Sputnik. Only pages 2 - 9 are provided.","PDF","NS01.TranscriptOfPressConf_Oct9_1957.pdf","","","Original","October 9, 1957","James C. Hagerty","In Conclusion: Student Document Research; Space Race","Presidency","Eisenhower Presidential Library","NASA; National Aeronautics and Space Administration; Space Race; Sputnik; Space; satellite","DDE's Papers as President, Press Conference Series, Box 6, Press Conference Oct. 9, 1957; NAID #12024539","NS01"
"409","Minutes of Cabinet Meeting","NS02.MinutesCabMtg_Oct18_1957.png","Only pages two and three are provided here.","PDF","NS02.MinutesCabMtg_Oct18_1957.pdf","","","Original","October 18, 1957","","In Conclusion: Student Document Research; Space Race","Presidency","Eisenhower Presidential Library","NASA; National Aeronautics and Space Administration; Space Race; Sputnik; Space; satellite","DDE's Papers as President, Cabinet Series, Box 9, Cabinet Meeting of 10/18/57; NAID #12024549","NS02"
"410","Memorandum from Dr. Killian to President Eisenhower ","NS03.Memo_KillianToDDE_Dec28_1957.png","This memo provides a progress report regarding missile and satellite programs.","PDF","NS03.Memo_KillianToDDE_Dec28_1957.pdf","","","Original","December 28, 1957","Dr. J.R. Killian","In Conclusion: Student Document Research; Space Race","Presidency","Eisenhower Presidential Library","NASA; National Aeronautics and Space Administration; Space Race; Sputnik; Space; satellite","DDE's Papers as President, Administration Series, Box 23, James R. Killian 1957 (2); NAID #12042591","NS03"
"411","Memorandum of Conference with the President, Dr. Killian, et al","NS04.Memo_ConfWithDDE_Mar5_1958.png","","PDF","NS04.Memo_ConfWithDDE_Mar5_1958.pdf","","","Original","March 5, 1958","A.J. Goodpaster","In Conclusion: Student Document Research; Space Race","Presidency","Eisenhower Presidential Library","NASA; National Aeronautics and Space Administration; Space Race; Sputnik; Space; satellite","DDE's Papers as President, DDE Diary Series, Box 31, Staff Notes March 1958 (2); NAID #12043739","NS04"
"412","Minutes of Cabinet Meeting","NS05.MinOfCabMtg_Mar14_1958.png","","PDF","NS05.MinOfCabMtg_Mar14_1958.pdf","","","Original","March 14, 1958","L.A. Minnich, Jr.","In Conclusion: Student Document Research; Space Race","Presidency","Eisenhower Presidential Library","NASA; National Aeronautics and Space Administration; Space Race; Sputnik; Space; satellite","DDE's Papers as President, Cabinet Series, Box 10, Cabinet Meeting of 3/14/58; NAID #12024551","NS05"
"413","Memorandum for Dr. Killian","NS06.MemoForKillian_Apr10_1958.png","Notes on NASA","PDF","NS06.MemoForKillian_Apr10_1958.pdf","","","Original","April 10, 1958","Robert Piland","In Conclusion: Student Document Research; Space Race","Presidency","Eisenhower Presidential Library","NASA; National Aeronautics and Space Administration; Space Race; Sputnik; Space; satellite","DDE's Records as President, Confidential File, Box 44, National Aeronautics and Space Administration (1); NAID #12060417","NS06"
"414","Memorandum for the President ","NS07.MemoForDDE_May10_1958.png","This memo concerns responsibility for space program.","PDF","NS07.MemoForDDE_May10_1958.pdf","","","Original","May 10, 1958","Maurice Stans","In Conclusion: Student Document Research; Space Race","Presidency","Eisenhower Presidential Library","NASA; National Aeronautics and Space Administration; Space Race; Sputnik; Space; satellite","DDE's Records as President, Official File, Box 769, OF 342 NASA (2)","NS07"
"415","Minutes of Cabinet Meeting","NS08.MinOfMtg_Aug15_1958.png","Only pages three and four are provided.","PDF","NS08.MinOfMtg_Aug15_1958.pdf","","","Original","August 15, 1958","L.A. Minnich, Jr.","In Conclusion: Student Document Research; Space Race","Presidency","Eisenhower Presidential Library","NASA; National Aeronautics and Space Administration; Space Race; Sputnik; Space; satellite","DDE's Papers as President, Cabinet Series, Box 12, Cabinet Meeting of 8/15/58; NAID #12042555","NS08"
"416","Memorandum for the Record","NS09.MemoForRec_July7_1958.png","This memo concerns President Eisenhower's meeting with Senator Lyndon B. Johnson","PDF","NS09.MemoForRec_July7_1958.pdf","","","Original","July 7, 1958","Wilton B. Persons","In Conclusion: Student Document Research; Space Race","Presidency","Eisenhower Presidential Library","NASA; National Aeronautics and Space Administration; Space Race; Sputnik; Space; satellite","DDE's Papers as President, DDE Diary Series, Box 35, Staff Notes July 1958 (2); NAID #12043761","NS09"
"417","Letter from Maurice Stans to President Eisenhower ","NS10.Letter_StansToDDE_July26_1958.png","This letter concerns  H.R. 12575, the National Aeronautics and Space Act","PDF","NS10.Letter_StansToDDE_July26_1958.pdf","","","Original","July 26, 1958","Maurice Stans","In Conclusion: Student Document Research; Space Race","Presidency","Eisenhower Presidential Library","NASA; National Aeronautics and Space Administration; Space Race; Sputnik; Space; satellite","White House Office: Records Officer Reports to President on Pending Legislation, Box 124, 7/29/58 HR 12575; NAID #12060429","NS10"
"418","Statement by the President ","NS11.StatementByDDE_July29_1958.png","This statement concerns H.R. 12575, the National Aeronautics and Space Act of 1958","PDF","NS11.StatementByDDE_July29_1958.pdf","","","Original","July 29, 1958","Dwight D. Eisenhower","In Conclusion: Student Document Research; Space Race","Presidency","Eisenhower Presidential Library","NASA; National Aeronautics and Space Administration; Space Race; Sputnik; Space; satellite","Kevin McCann Collection of Press Releases, Box21, July 1958; NAID #12060469","NS11"
"419","Memorandum, Dr. Killian to President Eisenhower","NS12.Memo_KillianToDDE_Aug23_1958.png","This memo concerns four earth satellites.","PDF","NS12.Memo_KillianToDDE_Aug23_1958.pdf","","","Original","August 23, 1958","Dr. J.R. Killian","In Conclusion: Student Document Research; Space Race","Presidency","Eisenhower Presidential Library","NASA; National Aeronautics and Space Administration; Space Race; Sputnik; Space; satellite","DDE's Papers as President, Administration Series, Box 23, James R. Killian 1957 (2); NAID #12042594","NS12"
"420","Minutes of Cabinet Meeting","NS13.MinutesOfCabMtg_May15_1959.png","Only page two is provided.","PDF","NS13.MinutesOfCabMtg_May15_1959.pdf","","","Original","May 15, 1959","","In Conclusion: Student Document Research; Space Race","Presidency","Eisenhower Presidential Library","NASA; National Aeronautics and Space Administration; Space Race; Sputnik; Space; satellite","DDE's Papers as President, Cabinet Series, Box 13, Cabinet Meeting of 5/15/59 (1); NAID #12042557","NS13"
"421","Letter from Dr. Glennan to President Eisenhower","NS14.Letter_GlennanToDDE_Sept8_1959.png","This letter concerns a proposal to the Soviet Union relating to cooperation in space research.","PDF","NS14.Letter_GlennanToDDE_Sept8_1959.pdf","","","Original","September 8, 1958","T. Keith Glennan","In Conclusion: Student Document Research; Space Race ","Presidency","Eisenhower Presidential Library","NASA; National Aeronautics and Space Administration; Space Race; Sputnik; Space; satellite","[DDE's Papers as President, Administration Series, Box 15, Dr. Keith Glennan-NASA; NAID #12042603","NS14"
"422","Memorandum from Dr. Kistiakowsky to General Goodpaster","NS15.Memo_DrKToGoodpaster_Sept15_1959.png","This memo concerns the coordination of satellite and space vehicle operations.","PDF","NS15.Memo_DrKToGoodpaster_Sept15_1959.pdf","","","Original","September 15, 1959","G.B. Kistiakowsky","In Conclusion: Student Document Research; Space Race ","Presidency","Eisenhower Presidential Library","NASA; National Aeronautics and Space Administration; Space Race; Sputnik; Space; satellite","DDE's Papers as President, Administration Series, Box 23, Dr. G.B. Kistiakowsky (2); NAID #12042598","NS15"
"423","Letter from Dr. Glennan to President Eisenhower","NS16.Letter_GlennanToDDE_Oct20_1959.png","This letter concerns budget matters.","PDF","NS16.Letter_GlennanToDDE_Oct20_1959.pdf","","","Original","October 20, 1959","T. Keith Glennan","In Conclusion: Student Document Research; Space Race ","Presidency","Eisenhower Presidential Library","NASA; National Aeronautics and Space Administration; Space Race; Sputnik; Space; satellite","DDE's Papers as President, Administration Series, Box 15, Dr. Keith Glennan-NASA; NAID #12042605","NS16"
"424","Memorandum for the President from Administrator of NASA and Secretary of Defense","NS17.MemoForDDE_Oct21_1959.png","This memo concerns the responsibility and organization for certain space activities.","PDF","NS17.MemoForDDE_Oct21_1959.pdf","","","Original","October 21, 1959","T. Keith Glennan and Thomas S. Gates","In Conclusion: Student Document Research; Space Race ","Presidency","Eisenhower Presidential Library","NASA; National Aeronautics and Space Administration; Space Race; Sputnik; Space; satellite","DDE's Records as President, Official File, Box 770, OF 342 NASA (7)","NS17"
"425","Memorandum for Dr. Kistiakowsky ","NS18.Memo_DrK_Nov14_1959.png","This memo concerns 1961 estimates.","PDF","NS18.Memo_DrK_Nov14_1959.pdf","","","Original","November 14, 1959","Jesse L. Mitchell","In Conclusion: Student Document Research; Space Race ","Presidency","Eisenhower Presidential Library","NASA; National Aeronautics and Space Administration; Space Race; Sputnik; Space; satellite","DDE's Records as President, Confidential File, Box 44, NASA (7); NAID #12060425","NS18"
"426","Letter from President Eisenhower to Dr. Glennan","NS19.Letter_DDEToGlennan_Dec29_1960.png"," This letter concerns DDE accepting his resignation as Administrator of NASA.","PDF","NS19.Letter_DDEToGlennan_Dec29_1960.pdf","","","Original","December 29, 1960","Dwight D. Eisenhower","In Conclusion: Student Document Research; Space Race ","Presidency","Eisenhower Presidential Library","NASA; National Aeronautics and Space Administration; Space Race; Sputnik; Space; satellite","DDE's Papers as President, Administration Series, Box 15, Dr. Keith Glennan-NASA; NAID #12042606","NS19"
"427","Memorandum, Edward O'Connor to Admiral Kirk","R01.PsychologicalStrategyBoard_Jan7_1953.png","This memo concerns the possibility of Rosenberg case carrying over into Eisenhower Administration.","PDF","R01.PsychologicalStrategyBoard_Jan7_1953.pdf","","","Original","January 7, 1953","Edward O'Conner","The Red Scare: Spies Among Us?; In Conclusion: Student Document Research","Presidency","Eisenhower Presidential Library","In Conclusion; Rosenbergs; espionage; Red Scare Russians; spies; Los Alamos; Nuclear; executive clemency","NSC Staff Papers, PSB Central Files Series, Box 26, PSB 383.4; NAID #12572003","R01"
"428","Application for Executive Clemency","R02.ApplicationforExecutiveClemency_January10_1953.png","","PDF","R02.ApplicationforExecutiveClemency_January10_1953.pdf","","","Original","January 10, 1953","Julius and Ethel Rosenberg","The Red Scare: Spies Among Us?; In Conclusion: Student Document Research","Presidency","Eisenhower Presidential Library","In Conclusion; Rosenbergs; espionage; Red Scare Russians; spies; Los Alamos; Nuclear; executive clemency","DDE's Records as President, Official File, Box 354, OF-101-R Amnesty- Pardons, Rosenberg, Julius and Ethel (2); NAID #12451358","R02"
"429","Memorandum from Kirk to Smith","R03.Memos_Attach_Jan15_1953.png","This memo concerns the foreign response to the Rosenberg case.","PDF","R03.Memos_Attach_Jan15_1953.pdf","","","Original","January 16, 1953","Alan G. Kirk","The Red Scare: Spies Among Us?; In Conclusion: Student Document Research","Presidency","Eisenhower Presidential Library","In Conclusion; Rosenbergs; espionage; Red Scare Russians; spies; Los Alamos; Nuclear; executive clemency","NSC Staff Papers, PSB Central Files Series, Box 26, PSB 383.4; NAID #12572004","R03"
"430","Letter from Stephens to Brownell and Draft of Presidential Statement by the Psycological Stategy Board","R04.DraftOfPresStatement_Jan30_1953.png","","PDF","R04.DraftOfPresStatement_Jan30_1953.pdf","","","Original","January 30, 1953","Tom Stephens and Psychological Stategy Board","The Red Scare: Spies Among Us?; In Conclusion: Student Document Research","Presidency","Eisenhower Presidential Library","In Conclusion; Rosenbergs; espionage; Red Scare Russians; spies; Los Alamos; Nuclear; executive clemency","DDE's Papers as President, Administration Series, Box 32, Rosenberg Case Statement; NAID #12572380","R04"
"431","Press Release, Statement by the President","R05.StatementByDDE_Feb11_1953.png","","PDF","R05.StatementByDDE_Feb11_1953.pdf","","","Original","February 11, 1953","James C. Hagerty","The Red Scare: Spies Among Us?; In Conclusion: Student Document Research","Presidency","Eisenhower Presidential Library","In Conclusion; Rosenbergs; espionage; Red Scare Russians; spies; Los Alamos; Nuclear; executive clemency","NSC Staff Papers, PSB Central Files Series, Box 26, PSB 383.4; NAID #12572005","R05"
"432","Minutes of Cabinet Meeting","R06.MinutesOfCabMtg_Feb12_1953.png","Only page three is provided here. It is the portion that concerns President Eisenhower's view of the Rosenberg case.","PDF","R06.MinutesOfCabMtg_Feb12_1953.pdf","","","Original","February 12, 1953","","The Red Scare: Spies Among Us?; In Conclusion: Student Document Research","Presidency","Eisenhower Presidential Library","In Conclusion; Rosenbergs; espionage; Red Scare Russians; spies; Los Alamos; Nuclear; executive clemency","DDE's Papers as President, Cabinet Series, Box 1, Cabinet Meeting of 2/12/53; NAID #12608508","R06"
"433","Memoranda from Hopkins to Stephens","R07.MemoToStephensFrHopkins_Feb12_1953.png","This memo concerns the public response to President's action in Rosenberg case.","PDF","R07.MemoToStephensFrHopkins_Feb12_1953.pdf","","","Original","February 12, 1953","William J. Hopkins","The Red Scare: Spies Among Us?; In Conclusion: Student Document Research","Presidency","Eisenhower Presidential Library","In Conclusion; Rosenbergs; espionage; Red Scare Russians; spies; Los Alamos; Nuclear; executive clemency","DDE's Records as President, Official File, Box 354, OF-101-R Amnesty-Pardons, Rosenberg, Julius and Ethel (1); NAID #12166850","R07"
"434","Memo of telephone conversation between Dulles and Hagerty","R08.MemoOfTeleConvFeb13_1953.png","This memo concerns the story of Pope's intervention.","PDF","R08.MemoOfTeleConvFeb13_1953.pdf","","","Original","February 13, 1953","","The Red Scare: Spies Among Us?; In Conclusion: Student Document Research","Presidency","Eisenhower Presidential Library","In Conclusion; Rosenbergs; espionage; Red Scare Russians; spies; Los Alamos; Nuclear; executive clemency","John Foster Dulles Papers, JFD Chronological Series, Box 1, Chronological - JFD February 1953 Telephone Calls; NAID #12608516","R08"
"435","Letter from C.D. Jackson to Herbert Brownell","R09.Letter,JacksontoBrownell.png","","PDF","R09.Letter,JacksontoBrownell.pdf","","","Original","February 23, 1953","C.D. Jackson","The Red Scare: Spies Among Us?; In Conclusion: Student Document Research","Presidency","Eisenhower Presidential Library","In Conclusion; Rosenbergs; espionage; Red Scare Russians; spies; Los Alamos; Nuclear; executive clemency","C.D. Jackson Records, Box 2, Herbert Brownell; NAID #18558036","R09"
"436","Memoranda for file ","R10.MemoForFilesFeb27_1953.png","This memo concerns Michael Rosenberg's note to President Eisenhower.","PDF","R10.MemoForFilesFeb27_1953.pdf","","","Original","February 27, 1953","","The Red Scare: Spies Among Us?; In Conclusion: Student Document Research","Presidency","Eisenhower Presidential Library","In Conclusion; Rosenbergs; espionage; Red Scare Russians; spies; Los Alamos; Nuclear; executive clemency","DDE's Records as President, Official File, Box 354, OF-101-R Amnesty-Pardons, Rosenberg, Julius and Ethel (1); NAID #12166857","R10"
"437","Memorandum from Korns to Craig","R11.MemoKornsToCraigMarch3_1953.png"," This memo concerns communism and Rosenberg case.","PDF","R11.MemoKornsToCraigMarch3_1953.pdf","","","Original","March 3, 1953","","The Red Scare: Spies Among Us?; In Conclusion: Student Document Research","Presidency","Eisenhower Presidential Library","In Conclusion; Rosenbergs; espionage; Red Scare Russians; spies; Los Alamos; Nuclear; executive clemency","NSC Staff Papers, PSB Central Files Series, Box 26, PSB 383.4; NAID #12572006","R11"
"438","Copy of Telegram and note for President Eisenhower","R12.Telegram_DillonToDDE_May20_1953.png","This correspondence concerns the foreign response to Rosenberg case.  The telegram was originally sent from General Smith to Ambassador Dillon, and then Dillon sent his reactions in this note to Secretary of State Dulles.  This copy of the correspondence was sent to President Eisenhower.  ","PDF","R12.Telegram_DillonToDDE_May20_1953.pdf","","","Original","May 20, 1953","","The Red Scare: Spies Among Us?; In Conclusion: Student Document Research","Presidency","Eisenhower Presidential Library","In Conclusion; Rosenbergs; espionage; Red Scare Russians; spies; Los Alamos; Nuclear; executive clemency","DDE's Papers as President, Administration Series, Box 32, Rosenberg Case Statement; NAID #12572529 and 12572697","R12"
"439","Flyer for a clemency rally","R13.Flyer_Rally_ND.png","This flyer for a clemency rally also includes Michael Rosenberg's letter to President Eisenhower.","PDF","R13.Flyer_Rally_ND.pdf","","","Original","","","The Red Scare: Spies Among Us?; In Conclusion: Student Document Research","Presidency","Eisenhower Presidential Library","In Conclusion; Rosenbergs; espionage; Red Scare Russians; spies; Los Alamos; Nuclear; executive clemency","DDE's Papers as President, Administration Series, Box 32, Rosenberg Case Statement; NAID #12572784","R13"
"439","Memoranda for file from C.D. Jackson","R14.MemoForFile.png","","PDF","R14.MemoForFile.pdf","","","Original","May 27, 1953","","The Red Scare: Spies Among Us?; In Conclusion: Student Document Research","Presidency","Eisenhower Presidential Library","In Conclusion; Rosenbergs; espionage; Red Scare Russians; spies; Los Alamos; Nuclear; executive clemency","C.D. Jackson Records, Box 5, R; NAID #12362096","R14"
"440","Memorandum from Taquey to Johnson","R15.Memo_TaqueyToJohnson_May29_1953.png","This memo concerns the influencing foreign response to Rosenberg case","PDF","R15.Memo_TaqueyToJohnson_May29_1953.pdf","","","Original","May 29, 1953","Charles Taquey","The Red Scare: Spies Among Us?; In Conclusion: Student Document Research","Presidency","Eisenhower Presidential Library","In Conclusion; Rosenbergs; espionage; Red Scare Russians; spies; Los Alamos; Nuclear; executive clemency","NSC Staff Papers, PSB Central Files Series, Box 17, PSB 092 (1); NAID #12572009","R15"
"441","Memorandum for Herbert Brownell from James Bennett ","R16.MemoToBrownell_June5_1953.png","This memo is a report of Bennett's interview with the Rosenbergs.  Bennett was the Director, U.S. Department of Justice, Bureau of Prisons.","PDF","R16.MemoToBrownell_June5_1953.pdf","","","Original","June 5, 1953","James Bennett","The Red Scare: Spies Among Us?; In Conclusion: Student Document Research","Presidency","Eisenhower Presidential Library","In Conclusion; Rosenbergs; espionage; Red Scare Russians; spies; Los Alamos; Nuclear; executive clemency","Herbert Brownell Papers, Box 75, B (3); NAID #12608524","R16"
"442","Letter from Clyde Miller to President Eisenhower","R17.Letter_MillerToDDE_June8_1953.png","In this letter, Clyde Miller is urging clemency for the Rosenbergs.","PDF","R17.Letter_MillerToDDE_June8_1953.pdf","","","Original","June 8, 1953","Clyde Miller","The Red Scare: Spies Among Us?; In Conclusion: Student Document Research","Presidency","Eisenhower Presidential Library","In Conclusion; Rosenbergs; espionage; Red Scare Russians; spies; Los Alamos; Nuclear; executive clemency","DDE's Papers as President, Administration Series, Box 32, Rosenberg Case Statement; NAID #12572866","R17"
"443","Response letter from DDE to Clyde Miller ","R18.RespLetterDDEtoMiller_June10_1953.png","This is President Eisenhower's response letter to Clyde Miller. Clyde's letter can also be found in this library.","PDF","R18.RespLetterDDEtoMiller_June10_1953.pdf","","","Original","June 10, 1953","Dwight D. Eisenhower","The Red Scare: Spies Among Us?; In Conclusion: Student Document Research","Presidency","Eisenhower Presidential Library","In Conclusion; Rosenbergs; espionage; Red Scare Russians; spies; Los Alamos; Nuclear; executive clemency","DDE's Papers as President, Administration Series, Box 32, Rosenberg Case Statement; NAID #12572955","R18"
"444","Memo of telephone conversation between Dulles and Brownell","R19.MemoOfPhoneConv_June12_1953.png","This conversation concerned foreign response to Rosenberg case.","PDF","R19.MemoOfPhoneConv_June12_1953.pdf","","","Original","June 12, 1953","","The Red Scare: Spies Among Us?; In Conclusion: Student Document Research","Presidency","Eisenhower Presidential Library","In Conclusion; Rosenbergs; espionage; Red Scare Russians; spies; Los Alamos; Nuclear; executive clemency","John Foster Dulles Papers, Telephone Conversation Series, Box 1, Telephone Memo May-June 1953 (2); NAID #12608519","R19"
"445","Memoranda of Telephone Conversation between John Foster Dulles and Herbert Brownell","R20.MemoOfPhoneConv_June16_1953.png","This conversation concerned Justice Douglas' stay of execution.","PDF","R20.MemoOfPhoneConv_June16_1953.pdf","","","Original","June 16, 1953","","The Red Scare: Spies Among Us?; In Conclusion: Student Document Research","Presidency","Eisenhower Presidential Library","In Conclusion; Rosenbergs; espionage; Red Scare Russians; spies; Los Alamos; Nuclear; executive clemency","John Foster Dulles Papers, Telephone Conversation Series, Box 1, Telephone Memo May-June 1953 (1); NAID #12608520","R20"
